rank,match,round,date,weekday,local_time,city,stadium,possible_matchup,priority_team,good_seat_price_estimate_usd,projected_weather,reason,matchup_score,price_fit_score,weekday_score,weather_score,recommendation_score
1,100,Quarterfinal,2026-07-11,Saturday,20:00,"Kansas City, MO",Arrowhead Stadium / Kansas City Stadium,Argentina vs Switzerland,Argentina,"$4,500-$7,500 target range for good sideline seats; premium midfield may exceed this","Hot/humid summer evening, roughly low 80s F at kickoff with thunderstorm risk.","Best upcoming Argentina value if they remain alive: quarterfinal stakes, weekend date, and still more reachable than semifinal/final.",4.9,4.3,5.0,2.8,4.56
2,102,Semifinal,2026-07-15,Wednesday,15:00,"Atlanta, GA",Mercedes-Benz Stadium / Atlanta Stadium,England vs Argentina,Argentina,"$6,000-$8,000 target for good seats; true lower-midfield could exceed budget",Hot/humid outside; retractable roof helps. Afternoon kickoff makes roof/indoor comfort valuable.,Highest-priority semifinal because it can include Argentina and possibly Norway/England from the other quarterfinal.,5.0,3.9,2.0,4.3,4.44
3,99,Quarterfinal,2026-07-11,Saturday,17:00,"Miami Gardens, FL",Hard Rock Stadium,Norway vs England,Norway,"$4,000-$7,500 target range; Haaland/England demand can push central lower seats higher","Hot, humid, thunderstorm/rainy-season risk; late afternoon kickoff helps only a little.",Top Norway-priority match now: Haaland/Odegaard/Nusa transition threat against England's improved collaborative attack.,4.8,4.0,5.0,2.5,4.43
4,104,Final,2026-07-19,Sunday,15:00,"East Rutherford, NJ",MetLife Stadium / New York New Jersey Stadium,France vs Argentina,"Argentina, France","$5,785-$7,380 public Cat. 3/Cat. 2 benchmark; true prime midfield reported near/above $10,990","Warm/humid July afternoon, around mid-80s F; open-air stadium, possible thunderstorm risk.",The best football event if budget is flexible. Within $3k-$8k is plausible only away from the very best midfield/lower seats.,5.0,2.8,5.0,2.7,4.31
5,101,Semifinal,2026-07-14,Tuesday,14:00,"Arlington, TX",AT&T Stadium / Dallas Stadium,France vs Spain,"France, Spain","$6,000-$8,000 target range for good seats; premium lower-midfield may exceed budget","Very hot outside, often mid-to-upper 90s F in July; retractable roof/indoor environment is a major plus.",Best non-Argentina elite match if the model path holds: France/Spain-level quality in a climate-controlled venue.,4.9,3.7,2.0,4.1,4.16
6,98,Quarterfinal,2026-07-10,Friday,12:00,"Inglewood, CA",SoFi Stadium,Spain vs Belgium,Spain,"$4,500-$7,000 target range for good seats","Mild/dry, likely comfortable; roof canopy helps. Noon start is less punishing than Texas/Miami.","Best Spain-focused value: quarterfinal stakes, comfortable venue, and likely inside the preferred good-seat band.",4.5,4.2,4.0,4.9,4.11
7,97,Quarterfinal,2026-07-09,Thursday,16:00,"Foxborough, MA",Gillette Stadium,France vs Morocco,France,"$4,000-$7,000 target range for good seats","Warm, humid New England summer; average July high near low 80s F; open-air stadium.",France priority plus a strong Morocco test. Excellent sporting value before semifinal/final pricing becomes painful.,4.4,4.0,2.7,3.3,4.0
8,103,Third-place Match,2026-07-18,Saturday,17:00,"Miami Gardens, FL",Hard Rock Stadium,Spain vs England,Spain,"$3,000-$6,000 target range; usually more attainable than the final","Hot, humid, thunderstorm/rainy-season risk; evening kickoff helps somewhat.","Often the best value for seeing two elite teams with less final-level price pressure, especially on a Saturday.",3.8,4.4,5.0,2.6,3.75
